{
  "artifact_refs": [
    "okv-eval://cold-object-row-v1/candidate",
    "/Users/wileyjones/Documents/doss/repos/okv/docs/artifacts/eval-receipts/cold-read-scale-g4.1/elastic-1mib-dev/candidate.json"
  ],
  "backend": "serving-worker-object-local-fs",
  "budget": {
    "kind": "operations",
    "limit": 10000.0,
    "observed": 7500.0
  },
  "candidate_commit": "a56442ad800deedd72a404a0886e88831eb308a0+dirty",
  "created_at": "2026-08-26T08:12:50.134661+00:00",
  "hard_gates": [
    {
      "id": "correctness_failures",
      "status": "pass"
    },
    {
      "id": "workload_execution",
      "status": "pass"
    },
    {
      "id": "budget_must_hold",
      "status": "pass"
    },
    {
      "id": "schema_valid",
      "status": "pass"
    },
    {
      "detail": "mode=candidate",
      "id": "exact_cold_point_reads",
      "status": "pass"
    },
    {
      "detail": "range_gets=7500,operations=7500",
      "id": "one_indexed_data_range_get",
      "status": "pass"
    },
    {
      "detail": "0",
      "id": "no_complete_object_gets",
      "status": "pass"
    },
    {
      "detail": "0",
      "id": "no_list_dependency",
      "status": "pass"
    },
    {
      "detail": "requests=1,bytes=638",
      "id": "single_manifest_warmup",
      "status": "pass"
    },
    {
      "detail": "requests=1,segments=1,bytes=1602",
      "id": "one_index_warmup_per_segment",
      "status": "pass"
    },
    {
      "detail": "actual=2240,budget=16777216",
      "id": "cached_metadata_within_local_budget",
      "status": "pass"
    },
    {
      "detail": "actual=479048400,max_per_read=65048",
      "id": "bounded_row_block_bytes",
      "status": "pass"
    }
  ],
  "lane": "elastic-cold-point",
  "parent_commit": "50cb23f2897905b35030782dfcb80ec23265ae7f",
  "primary_metric": {
    "direction": "lower",
    "mad": 0.0,
    "median": 1.0,
    "name": "okv.eval.object_store.requests",
    "samples": [
      1.0
    ],
    "unit": "{request}"
  },
  "profile": {
    "hash": "2135085bd79ad700953df6078b72668d7aa465d1d024b848eb1c4321073f355b",
    "id": "elastic-1mib-dev",
    "lockfile_hash": "c6c49a2558609826c4712eadc16aea5a3c087f66f5a7ecb9fc8eeef9f08878a2",
    "machine": "arm64",
    "rustc": "rustc 1.88.0 (6b00bc388 2025-06-23)"
  },
  "reason": "diagnostic dirty-tree run; hard gates passed but the result is not comparable",
  "run_id": "9842bac8-673f-48b5-81d2-4a3c47159b29",
  "schema_version": 1,
  "secondary_metrics": {
    "cold.block_count": 17.0,
    "cold.bytes_per_operation": 63873.12,
    "cold.data_object_bytes": 1074346.0,
    "cold.index_bytes": 1602.0,
    "cold.latency_ns.p50": 166583.0,
    "cold.latency_ns.p99": 214417.0,
    "cold.manifest_bytes": 638.0,
    "cold.max_block_bytes": 65048.0,
    "cold.max_data_object_bytes": 1074346.0,
    "cold.max_index_bytes": 1602.0,
    "cold.metadata_bytes": 2240.0,
    "cold.profile_repeats": 5.0,
    "cold.requests_per_operation": 1.0,
    "cold.segment_count": 1.0,
    "operation.duration.median": 1.260630292
  },
  "seeds": [
    1103,
    2207,
    3301
  ],
  "suite": "objectkv-product-thesis-physical-v1",
  "suite_hash": "2ae0eee3feef7c2149e7a1373467b78dc048c5c922783eeebde28802be5a8bfa",
  "verdict": "inconclusive"
}
