{
  "artifact_refs": [
    "okv-eval://empty-worker-row-v1/lazy_candidate",
    "/Users/wileyjones/Documents/doss/repos/okv/docs/artifacts/eval-receipts/empty-worker-g4.2/recovery-1mib-dev/candidate.json"
  ],
  "backend": "serving-worker-empty-local-fs",
  "budget": {
    "kind": "seconds",
    "limit": 300.0,
    "observed": 0.016115291
  },
  "candidate_commit": "a56442ad800deedd72a404a0886e88831eb308a0+dirty",
  "created_at": "2026-08-26T08:29:00.506595+00:00",
  "hard_gates": [
    {
      "id": "correctness_failures",
      "status": "pass"
    },
    {
      "id": "workload_execution",
      "status": "pass"
    },
    {
      "id": "budget_must_hold",
      "status": "pass"
    },
    {
      "id": "schema_valid",
      "status": "pass"
    },
    {
      "detail": "samples=15",
      "id": "exact_first_read",
      "status": "pass"
    },
    {
      "detail": "exact named manifest root",
      "id": "no_list_dependency",
      "status": "pass"
    },
    {
      "detail": "638",
      "id": "one_manifest_get",
      "status": "pass"
    },
    {
      "detail": "closure_segments=1",
      "id": "one_selected_index_get",
      "status": "pass"
    },
    {
      "detail": "closure_bytes=1074346",
      "id": "one_data_range_get_without_hydration",
      "status": "pass"
    },
    {
      "detail": "bound=67288",
      "id": "selected_metadata_and_block_byte_bound",
      "status": "pass"
    }
  ],
  "lane": "empty-worker-recovery",
  "parent_commit": "50cb23f2897905b35030782dfcb80ec23265ae7f",
  "primary_metric": {
    "direction": "lower",
    "mad": 0.000021124999999999985,
    "median": 0.00028,
    "name": "okv.eval.recovery.first_correct_read_duration",
    "samples": [
      0.000496958,
      0.00028,
      0.000303875,
      0.0002895,
      0.000318834,
      0.00030325,
      0.000284167,
      0.0002555,
      0.000257291,
      0.000267375,
      0.000258875,
      0.000263167,
      0.000256167,
      0.000275125,
      0.000281917
    ],
    "unit": "s"
  },
  "profile": {
    "hash": "1d8fd0b5a7fc9e044b7928cb55a7c0a0f2af6ce2493684f5af4e8e506225fcfa",
    "id": "recovery-1mib-dev",
    "lockfile_hash": "c6c49a2558609826c4712eadc16aea5a3c087f66f5a7ecb9fc8eeef9f08878a2",
    "machine": "arm64",
    "rustc": "rustc 1.88.0 (6b00bc388 2025-06-23)"
  },
  "reason": "diagnostic dirty-tree run; hard gates passed but the result is not comparable",
  "run_id": "e255e974-26ac-4322-9725-5900576e8b31",
  "schema_version": 1,
  "secondary_metrics": {
    "operation.duration.median": 0.016115291,
    "recovery.data_closure_bytes": 1074346.0,
    "recovery.first_read_seconds.median": 0.00028,
    "recovery.index_closure_bytes": 1602.0,
    "recovery.manifest_bytes": 638.0,
    "recovery.max_block_bytes": 65048.0,
    "recovery.max_index_bytes": 1602.0,
    "recovery.response_bytes.median": 67288.0,
    "recovery.segment_count": 1.0
  },
  "seeds": [
    1103,
    2207,
    3301
  ],
  "suite": "objectkv-product-thesis-physical-v1",
  "suite_hash": "9f37becf9dd7d3ae7e574f92dc49d2fecf5ef28b7cae68f13d5534861e378056",
  "verdict": "inconclusive"
}
