{
  "artifact_refs": [
    "okv-eval://cold-object-row-v1/direct_control",
    "docs/artifacts/eval-receipts/cold-read-g4.1/control.json"
  ],
  "backend": "indexed-object-reader-local-fs",
  "budget": {
    "kind": "operations",
    "limit": 10000.0,
    "observed": 7500.0
  },
  "candidate_commit": "a56442ad800deedd72a404a0886e88831eb308a0+dirty",
  "created_at": "2026-08-26T07:53:54.663157+00:00",
  "hard_gates": [
    {
      "id": "correctness_failures",
      "status": "pass"
    },
    {
      "id": "workload_execution",
      "status": "pass"
    },
    {
      "id": "budget_must_hold",
      "status": "pass"
    },
    {
      "id": "schema_valid",
      "status": "pass"
    },
    {
      "detail": "mode=direct_control",
      "id": "exact_cold_point_reads",
      "status": "pass"
    },
    {
      "detail": "range_gets=7500,operations=7500",
      "id": "one_indexed_data_range_get",
      "status": "pass"
    },
    {
      "detail": "0",
      "id": "no_complete_object_gets",
      "status": "pass"
    },
    {
      "detail": "0",
      "id": "no_list_dependency",
      "status": "pass"
    },
    {
      "detail": "requests=1,bytes=93210",
      "id": "single_index_warmup",
      "status": "pass"
    },
    {
      "detail": "actual=487860000,max_per_read=65048",
      "id": "bounded_row_block_bytes",
      "status": "pass"
    }
  ],
  "lane": "elastic-cold-point",
  "parent_commit": "50cb23f2897905b35030782dfcb80ec23265ae7f",
  "primary_metric": {
    "direction": "lower",
    "mad": 0.0,
    "median": 1.0,
    "name": "okv.eval.object_store.requests",
    "samples": [
      1.0
    ],
    "unit": "{request}"
  },
  "profile": {
    "hash": "a306088896dc6a4838cd1729501f744092dd370855460c712b84be85fe9749d1",
    "id": "elastic-dev",
    "lockfile_hash": "c6c49a2558609826c4712eadc16aea5a3c087f66f5a7ecb9fc8eeef9f08878a2",
    "machine": "arm64",
    "rustc": "rustc 1.88.0 (6b00bc388 2025-06-23)"
  },
  "reason": "diagnostic dirty-tree run; hard gates passed but the result is not comparable",
  "run_id": "a5e98b01-5ec4-424b-bd6d-9c06073237c0",
  "schema_version": 1,
  "secondary_metrics": {
    "cold.block_count": 1058.0,
    "cold.bytes_per_operation": 65048.0,
    "cold.data_object_bytes": 68757844.0,
    "cold.index_bytes": 93210.0,
    "cold.latency_ns.p50": 2197708.0,
    "cold.latency_ns.p99": 2371458.0,
    "cold.max_block_bytes": 65048.0,
    "cold.profile_repeats": 5.0,
    "cold.requests_per_operation": 1.0,
    "operation.duration.median": 20.918750791
  },
  "seeds": [
    1103,
    2207,
    3301
  ],
  "suite": "objectkv-product-thesis-physical-v1",
  "suite_hash": "969c65e980a1d72c0d8fd2b2adc31eb64383d776428ba3100cdef6bce52bd232",
  "verdict": "inconclusive"
}
